{
  "schema_version": 1,
  "run_id": "20261012-005931-1dd77e",
  "items": {
    "REQ-001": {
      "id": "REQ-001",
      "kind": "requirement",
      "provenance": "customer_requirement",
      "source_artifact": "requirements.json",
      "approval": "approved",
      "issues": [],
      "decision_ids": [
        "DEC-002"
      ],
      "stale": false,
      "stale_reason": null,
      "superseded_by": null
    },
    "REQ-002": {
      "id": "REQ-002",
      "kind": "requirement",
      "provenance": "customer_requirement",
      "source_artifact": "requirements.json",
      "approval": "approved",
      "issues": [
        "unknown"
      ],
      "decision_ids": [
        "DEC-003"
      ],
      "stale": false,
      "stale_reason": null,
      "superseded_by": null
    },
    "REQ-003": {
      "id": "REQ-003",
      "kind": "requirement",
      "provenance": "customer_requirement",
      "source_artifact": "requirements.json",
      "approval": "approved",
      "issues": [],
      "decision_ids": [
        "DEC-001"
      ],
      "stale": false,
      "stale_reason": null,
      "superseded_by": null
    }
  },
  "registered_artifacts": {
    "requirements.json": "4b704ceb3eb4c968195f3b8aed74ace48da3e9d0737266644e1265e0c3801ea0"
  }
}
