{
  "schema_version": 1,
  "run_id": "20261011-120000-abcdef",
  "items": {
    "REQ-001": {
      "id": "REQ-001",
      "kind": "requirement",
      "provenance": "customer_requirement",
      "source_artifact": "requirements.json",
      "approval": "approved",
      "issues": [],
      "decision_ids": [
        "DEC-001"
      ],
      "stale": false,
      "stale_reason": null,
      "superseded_by": null
    },
    "REQ-002": {
      "id": "REQ-002",
      "kind": "requirement",
      "provenance": "customer_requirement",
      "source_artifact": "requirements.json",
      "approval": "not_reviewed",
      "issues": [],
      "decision_ids": [],
      "stale": false,
      "stale_reason": null,
      "superseded_by": null
    },
    "REQ-003": {
      "id": "REQ-003",
      "kind": "requirement",
      "provenance": "customer_requirement",
      "source_artifact": "requirements.json",
      "approval": "rejected",
      "issues": [],
      "decision_ids": [
        "DEC-002"
      ],
      "stale": false,
      "stale_reason": null,
      "superseded_by": null
    },
    "REQ-005": {
      "id": "REQ-005",
      "kind": "requirement",
      "provenance": "customer_requirement",
      "source_artifact": "requirements.json",
      "approval": "not_reviewed",
      "issues": [],
      "decision_ids": [],
      "stale": false,
      "stale_reason": null,
      "superseded_by": null
    },
    "REQ-006": {
      "id": "REQ-006",
      "kind": "requirement",
      "provenance": "user_decision",
      "source_artifact": "decisions.json",
      "approval": "approved",
      "issues": [],
      "decision_ids": [
        "DEC-001"
      ],
      "stale": false,
      "stale_reason": null,
      "superseded_by": null
    }
  },
  "registered_artifacts": {}
}